{
  "manifestVersion": "1.0",
  "mode": "reviewer",
  "project": {
    "name": "task-proof-visualizer",
    "repository": "dongfanghong656/visual-explainer",
    "branch": "feature/example",
    "base": "1111111",
    "head": "2222222"
  },
  "task": {
    "id": "TPV-001",
    "title": "Reject unsupported completion claims",
    "objective": "Independently verify the paired evidence rule."
  },
  "checkpoint": {
    "capturedAt": "2026-08-25T00:10:00Z",
    "actor": "review-ai"
  },
  "acceptance": [
    {
      "id": "AC-1",
      "text": "A done code claim with primary diff and test evidence validates as verified.",
      "status": "pass",
      "evidenceRefs": ["RV-FILE", "RV-TEST"]
    }
  ],
  "evidence": [
    {
      "id": "RV-FILE",
      "type": "file",
      "locator": "file:src/core.mjs#evaluateClaim",
      "summary": "Reviewer reopened the rule implementation.",
      "result": "pass",
      "trust": "primary"
    },
    {
      "id": "RV-TEST",
      "type": "test",
      "locator": "test-report:reviewer-node-test.txt#case=valid-code-claim",
      "summary": "Independent test run reproduced the expected verdict.",
      "result": "pass",
      "trust": "primary"
    }
  ],
  "claims": [
    {
      "id": "CL-1",
      "title": "Paired evidence gate",
      "summary": "Reviewer independently verified the paired evidence gate.",
      "category": "code",
      "claimStatus": "done",
      "reviewDisposition": "accepted",
      "acceptanceRefs": ["AC-1"],
      "evidenceRefs": ["RV-FILE", "RV-TEST"],
      "blockers": [],
      "risks": [],
      "dependsOn": []
    }
  ],
  "unknowns": [],
  "risks": [],
  "nextActions": []
}
